,Coaching Name,Coaching Phone_Number,Coching Address
0,PROGRAMMERS POINT,079742 50782,"1st Floor, GD Prime, Bhawarkua Main Rd, opposite Petrol Pump NEXA showroom, Indore, Madhya Pradesh 452001"
1,LIVEWIRE INDORE,NaN,"#206, 2nd Floor, Fortune Aura Business park ( Kyro Building 1, Gurmeet Nagar, Bhanwarkua Main Road Landmark- Above Nexa Car Showroom, near Apple hospital, Indore, Madhya Pradesh 452014"
2,IIC - Indore Institute of Computers(C/C++) By Shashank Sir,083700 00690,"201, Shri Balaji Heights, 5-B, Gita Bhawan Rd, above Ashirwad Bhojnalay, Rajgarh Kothi, Sqr, Indore, Madhya Pradesh 452001"
3,Universal Informatics,0731 243 1972,"Abhay Prashal Building, B-WING, Race Course Rd, opp. IDA Building, Indore, Madhya Pradesh 452003"
4,IOTA ACADEMY | Data Analytics & Placement Training Institute | Best Rated Institute in Indore,078696 64602,"2nd Floor, AB Rd, above Central Coffee House, opp. Sky Heights, Navlakha, Angad Kapoor Region, Chouraha, Indore, Madhya Pradesh 452001"
5,MCU College | TOP College for Msc(Computer sc) | BCA | Bcom(Computer Application ) in Indore,098260 10276,"2nd FLOOR 203 ALANKAR POINT GEETA BHAWAN SUQARE, AB Rd, Indore, Madhya Pradesh 452001"
6,Best Ethical Hacking | Programming Institute in Indore India | Hakimi Infosec,087180 00520,"351, Saifee Nagar Main Rd, Transport Nagar, Indore, Madhya Pradesh 452001"
7,SSi Digital Academy,088890 83030,"11, Bhawarkua Main Rd, Professor Colony, Indore, Madhya Pradesh 452014"
8,"Online School of Programming, Python, Data Science, Java, Full Stack, Cloud, Testing, Selenium, C, C++ Training in Indore",098270 44222,"Kohinoor Tower, Shop no-218, First Floor, Jawahar Marg, North Rajmohalla, Indore, Madhya Pradesh 452002"
9,CTL Academy (Coden Technology Learning),089894 52663,"Gold Coin Plaza, Coden Technology Learning (CTL Indore 206, above Union Bank, near Reliance Digital, Tower Square, Indore, Madhya Pradesh 452001"
10,Prestige Point,083193 38570,"Rafael Tower, 403-404, Greater Kailash Road, Near Saket Square, New Palasia, Indore, Madhya Pradesh 452001"
11,Programming World By Pankaj Wadhwani,074155 59991,"182, Greater Vaishali Nagar, Indore, Madhya Pradesh 452009"
12,CodeMantra - java classes in Indore,089594 90906,"109 Orange Business Park Above MacDonald, Bhawarkua Main Rd, near Apple Hospital, Indore, Madhya Pradesh 452001"
13,"Samyak Classes, Indore",095227 39800,"104, 2nd Floor, Shagun Tower, AB Rd, above Apna Sweets, Near C21 Mall, Near Vijay Nagar Square, Indore, Madhya Pradesh 452010"
14,Vidyut Singhai Classes,093017 70335,"21, 10, near G.Sacchanand Kala Mandir, Vijay Nagar, Indore, Madhya Pradesh 452001"
15,Placements Adda | IT Training Institute Indore,096447 04844,"5, Vishnu Puri, 103, Sukhmani Apartment, Above Union Bank AB Road, Bhawarkua Main Rd, Indore, Madhya Pradesh 452014"
16,Pristine Institute,089827 04147,"Sapphire Square Tower, 310, 3rd floor, Chouraha, Ashok Nagar, Indore, Madhya Pradesh 452001"
17,Concept Solution,093001 32121,"Ground Floor, Radhakrishna Complex, Bhawarkua Main Rd, Opposite Apple Hospital, Khatiwala Tank, Indore, Madhya Pradesh 452001"
18,IT Training Indore,090091 42926,"Office No. 217-218, 3rd Floor, Onam Plaza, Beside Industry House, Infront of iBus Stop, New Palasia, Indore, Madhya Pradesh 452001"
19,Infoviaan Technolgies,070492 90123,"21, 10, Vijay Nagar, Indore, Madhya Pradesh 452010"
20,Coding with Shikhar,NaN,"B11 Flat, 502, Treasure Fantasy Main Rd, RRCAT, Indore, Madhya Pradesh 453331"
21,"Samyak Computer Classes, Bhawar Kua, Indore",095227 39800,"201, 2nd Floor, Fortune Aura, KYRO Building Bhawar Kuan Square Apple hospital :, above Maruti Showroom, Indore, Madhya Pradesh 452014"
22,Softwaves Technologies,097703 97704,"Shagun Arcade, Office No. 414, P4, Ground, AB Rd, Near C21 Mall, Near Vijay Nagar Square, Scheme 54 PU4, Indore, Madhya Pradesh 452011"
23,CodeBetter,088230 75444,"Shekhar central, 514, Palasia Square, Indore, Madhya Pradesh 452001"
24,Shiva Concept Solution,0731 406 9788,"Kanchan Sagar, M-6, Building, 18, Indore, Madhya Pradesh 452001"
25,Future Multimedia,098933 85789,"114, Orange Business Park, Bhawarkua Main Rd, Indore, Madhya Pradesh 452001"
26,E-Skills Web | Full Stack Development Mern Mean Python Web Design Training In Indore,098937 21920,"204 Royal Ratan Building, 7, Mahatma Gandhi Rd, Indore, Madhya Pradesh 452001"
27,Codex Cider ( Computer Programming Classes ),088190 76632,"665, 9, Atal Dwar Main Rd, Near MIG Thana, Nehru Nagar, Indore, Madhya Pradesh 452011"
28,TechnoSoft Informatics,0731 428 3492,"201 Western Business Centre,, New Palasia, Indore, Madhya Pradesh 452001"
29,Anuranjan Mastermind Computers,098260 64637,"AM 181, Sukhliya Main Road, Bharat Mata Mandir, Near Bapat Square, Indore, Madhya Pradesh 452010"
30,"Makerspace Technologies - Best Coaching Centre, Training Centre, Digital Marketing Institute, Professional Training Centre",081090 66529,"Building no.223, above Punjab National Bank Khatiwala Tank, Saifee Nagar, Indore, Madhya Pradesh 452014"
31,Platforuma,086027 93619,"2nd Floor, Malwa Tower, near, Bhawarkua Main Rd, Near ICICI Bank, Ashok Nagar, Indore, Madhya Pradesh 452001"
32,Codersdaily | Data Analytics | Data Science | React Js | Flutter | Python | Golang | Best IT Training Institute in Indore,097522 85534,"26-B, Sapna Sangeeta Rd, near HDFC Bank, Navlakha, Indore, Madhya Pradesh 452001"
33,ELITE Techsoft,079745 19624,"901, KB Complex, Motichowk, above Muthoot finance bank, Dr. Ambedkar Nagar"
34,"Software Training Institute Classes Courses Indore - Python Coaching, Full Stack web developer",091113 33800,"113/A, 1st Floor Orange Business Park, Bhawarkua Main Rd, near Apple Hospital, Indore, Madhya Pradesh 452001"
35,Success Computer Center,091797 52526,"Sapphire Square Tower, Office No.101, Tower Choraha, Bhanwar Kuwa, Indore, Madhya Pradesh 452001"
36,SSIT - Computer & IT Training in Indore,0731 406 0210,"6/2 Bairathi Colony,Makhija Complex Near Bank Of India,Tower Square, Madhya Pradesh 452001"
37,Wincom Technologies,NaN,"405, Shreenathji Avenue, 158-RNT Marg, Road, Chhawni, Indore, Madhya Pradesh 452001"
38,Programming Stairs,NaN,"CH - 94, Sukhlia, Sector CH, Sukhlia, Indore, Madhya Pradesh 452010"
39,"Shiva Concept Solution Vijay Nagar, Best JAVA, PYTHON , Software Testing, Internship, Online Class, Digital Marketing, Basic Computer Training, React Js, NODE JS Training in Indore, Django Data Science, Machine Learning Training In Indore",NaN,"SICA SCHOOL Road Above Indian Bank OPPOSITE RESTRO Scheme No 54, Indore, Madhya Pradesh 452001"
40,Universal Informatics,0731 498 6251,"160/3, Pipliyarao, Bhawarkua, A.B. Road, Near Bholaram Ustad Marg, Opp I-Bus Stop & Ahuja TVS, Indore, Madhya Pradesh 452014"
41,"RAYS Technologies | Corporate Java Training in Indore, Machine Learning in Indore",0731 424 9244,"212 President Tower, 6/2 South Tukogunj, Madhumilan Square, Indore, Madhya Pradesh 452001"
42,Softtech,077489 63566,"Sundaram Complex, 153 , First Floor, Indore, Madhya Pradesh 452014"
43,Bignalytics | Python | Data Science | Machine Learning | Artificial Intelligence | Ethical Hacking,NaN,"406, Bansiwala Tower, Above Morni Saari Agrasen Square, Sapna Sangeeta Rd, Indore, Madhya Pradesh 452014"
44,Web Next Technology,078794 11522,"205 Krishna Tower 1/2 New Palasia, Near JanJeerwala Square, Indore, Madhya Pradesh 452001"
45,Samyak Computer Classes,NaN,"313, Tulsi Tower, Gita Bhawan Rd, South Tukoganj, Indore, Madhya Pradesh 452001"
46,i-Nate Education,NaN,"Ranawat Trade Center, 105-106, Bhanwarkuan, Square, Indore, Madhya Pradesh 452001"
47,"SHIVA CONCEPT SOLUTION Bhawarkua , Java, Python, PHP, C, C++, React, Node, Salesforce, Software Testing, DEVOPS, AWS classes",096306 23876,"Prem Plaza, 204, Bhawarkua Main Rd, near Tower Square, opp. Canara Bank, Ashok Nagara, Indore, Madhya Pradesh 452014"
48,genext computer,098930 78853,"B-24 ,Scheme no.71 Behind ranjit hanuman mandir , oppo. somani jewelles, near राहुल किराना स्टोर, Indore, Madhya Pradesh 452009"
49,Leo Technology,097530 60060,"13 Dr, near LIG Square, Mig Colony, Ambedkar Nagar, Indore, Madhya Pradesh 452010"
50,"ITShala | We provide job oriented courses | Web & App development training in Indore | Java, PHP, Web & Graphic Designing, Digital Marketing | HR & BDE Internship",099936 55520,"Navrang Plaza, 209, Sapna Sangeeta Rd, near Tower Square, Indore, Madhya Pradesh 452001"
51,Code School - Python personal tuitions,NaN,"Flat No.101, R113, Khatiwala Tank, Indore, Madhya Pradesh 452014"
52,Console Dude - Digital marketing,096914 26068,"3rd Floor, Plot no. 34. Scheme No.53, Ratnalok colony, near power house C/o Pi Technologies, Vijay Nagar, Indore, Madhya Pradesh 452010"
53,"Kodblock | Android Development Class , Android Development Without Coding | Coding Class For Kids or Kids Coding Class",087704 40466,"303 Sapphire Square, Madhya Pradesh 452001"
54,Tech Cluster - Autocad Training Centre in Indore,NaN,"125, 1st floor, Veda Business Park, Bhawarkua Main Rd, Indore, Madhya Pradesh 452014"
55,Global Computer Education,093010 16101,"19/2, Badwani Plaza, 1st Floor, Old Palasia Behind Palasia Police Thana, Indore, Madhya Pradesh 452001"
56,Adixoo Tech IT Software Training,070890 91927,"shop number 110 Scheme number 103, Babu Lalchand Chajlani Rd, Indore, Madhya Pradesh 452001"
57,"The Stepping Stone | php,node,angular training in indore",0731 253 1019,"301, Third Floor, Goldstar Building,, M. G. Road, Opposite Treasure Island Mall, Indore, Madhya Pradesh 452001"
58,Nainwas Computer Education,097531 70760,"Gattani Enterprises, 19 professor colony, Bhawarkua Main Rd, Near Allahabad Bank, Indore, Madhya Pradesh 452001"
59,"Excel Info Savera Education , Advanced Excel Classes indore, Corporate Training, MIS Training",088150 03922,"104B, near Barfani Dham, Shardha Shri Colony, Indore, Madhya Pradesh 452011"
60,Robozz Lab,082530 11002,"Sundaram Complex, 126, 1st floor, Bhawarkua Main Rd, above canara bank, Transport Nagar, Indore, Madhya Pradesh 452001"
61,Sterling Institute,091099 13455,"Apple Hospital, near, 110 - Fortune Aura (Kyro, Bhawarkua Main Rd, Indore, Madhya Pradesh 452001"
62,InfoBeans Foundation,NaN,"Rafael Tower, Greater Kailash Road, New Palasia, Indore, Madhya Pradesh 452001"
63,Code Solution Lab,0731 493 3797,"199, Mahadev Totla Nagar Rd, Mahadeo Totla Nagar, Utkarsh Estate, Indore, Madhya Pradesh 452016"
64,E-Herex Skills Indore,0731 400 7900,"60 SHANKAR BAGH, Neelkanth Colony Main Rd, above SBI, Sadar Bazar, Indore, Madhya Pradesh 452006"
65,Edsystango,088199 99807,"Scheme No. 94, Ring Road, Pipliyahana, Square Service Road, Goyal Nagar, Indore, Madhya Pradesh 452016"
66,Ethical Hacking Training Institute and Course Indore - Appin Indore,073899 33778,"Indraprastha Tower, 328, 3rd floor, Mahatma Gandhi Rd, Indore, Madhya Pradesh 452001"
67,Being IT Development,087707 19144,"77, Bengali Square, Telephone Nagar, Indore, Madhya Pradesh 452016"
68,Bytecoder,NaN,"1st Floor,Verma Complex, Bhawarkua Main Rd, near ICICI ATM, near Deendayal Upadhyay Garden, Vishnu Puri Colony, Indore, Madhya Pradesh 452001"
69,"IT Training Institute & Internship Indore | Blockchain, Flutter, Python, QA | Infograins | Atulya IT Park Indore, India",096915 99314,"605, Atulya IT Park, Bhawarkua Main Rd, Indore, Madhya Pradesh 452010"
70,"Disha Computer Institute, Bhawarkua Branch, Indore",NaN,"1st Floor, Thakur bhawan Bhawarkua Main Road, Service Road, near Holkar Collage, Ashok Nagar, Indore, Madhya Pradesh 452001"
71,Artificial Edge,096442 78830,"Alankar Point, B-7, Gita Bhawan Rd, Indore, 452001"
72,Genext Computers,098930 78853,"Below Punjab Jewelers, Gold Plaza, Basement, Mahatma Gandhi Rd, Below Punjab Jewelers, Opposite Treasure Island Mall, Mahatma Gandhi Road, Mall, Opposite Treasure Island, New Palasia, Indore, Madhya Pradesh 452001"
73,CAD training institute indore,NaN,"303 3rd Floor, veda business park, Bhawarkua Main Rd, Indore, Madhya Pradesh 452001"
74,Tech Forest,093990 93728,"5th Floor 507,Rajani Bhawan,M.G.Road, Yashwant Niwas RD, Madhya Pradesh 452001"
75,SunilOS InfoTech Pvt Ltd,0731 424 9244,"211, 6/2 Indore, Madhya Pradesh, India President Tower, National Highway 59, Chhoti Gwaltoli, Indore, Madhya Pradesh 452001"
76,IICE - Training Institute,091114 33444,"First Floor Office Number 133 Veda Business Park, Bhawarkuan Square, Madhya Pradesh 452001"
77,Softbuzz Innovation Indore,097139 50629,"212, Bhawarkua Main Rd, near Veda Complex, Bhawarkua, square, Indore, Madhya Pradesh 452001"
78,codeXpert -Java coaching Indore | PHP coaching Indore,NaN,"Piplayarao Saraswati Complex 107 Agra Bombay Road, Bhawarkua Main Rd, Vishnu Puri Colony, Indore, Madhya Pradesh 452014"
79,CADDESK- Best AutoCAD Training Center In Indore,088712 82975,"2nd FLOOR 205 ALANKAR POINT, GEETA BHAWAN SQUARE, A B ROAD INDORE, Indore, Madhya Pradesh 452001"
80,Tech Ocean Technology,086021 64465,"G-1, Nakoda Apartment, near Poly Clinic, Indore, Madhya Pradesh 452001"
81,Antas Software Solutions,0731 497 4630,"Shop no. UG 5, 6,7, Kanchan Sagar building, next Bank of India and Bank of Baroda, next to Industry House, building, New Palasia, Indore, Madhya Pradesh 452001"
82,Being Gourav,NaN,"320 ,PU4, SCHEME NO. 54, Vijay Nagar, Indore, Madhya Pradesh 452010"
83,Web design and development institute in Indore -Genext,098273 03634,"2nd Floor, Ahinsa Tower, Mahatma Gandhi Rd, Indore, Madhya Pradesh 452001"
84,EdSigma,063514 46580,"411 TBC Tower, Near Geeta Bhavan Square, Main, AB Rd, Indore, Madhya Pradesh 452001"
85,New Horizons,NaN,"PVGQ+X3H, AB Rd, Navlakha, Indore, Madhya Pradesh 452001"
86,TechiesAdda,070475 75000,"P101, Metro Tower, Near Vijay Nagar Square, Indore, Madhya Pradesh 452010"
87,SyStos Training Institute,094250 30694,"505, 5th Floor, President Tower, Madhumilan Square, RNT Marg, Indore, Madhya Pradesh 452001"
88,SaiTechSoft,NaN,"Radha Krishna Plaza, 202, 6-A, Geeta Bhavan Temple, Kailash Park Colony, Indore, Madhya Pradesh 452001"
89,Shree Balaji Computer,098932 63736,"32/54, Khasgi Ka Bagicha, Nanda Nagar, Vrindavan Colony, Indore, Madhya Pradesh 452015"
90,Progressive Computers Institute,096856 15564,"4, 1st Floor, Mangal Nagar, Mangal Nagar Main Rd, opp. SBI, DDU Nagar, Sukhlia, Indore, Madhya Pradesh 452010"
91,CASTEK ACADEMY,070475 75000,"VIJAY NAGAR SQUARE,101- 1st floor,Metro Tower, near Mangal city, Scheme No 54, Indore, Madhya Pradesh 452010"
92,22 Century Technologies CNC Programming,NaN,"Plot 16, Agra Bombay Road, near Somya Vehicles (Mahindra Showroom, Baap Jee Nagar, Indore, Madhya Pradesh 453331"
93,DIGITAL CADD WORLD,NaN,"135, Marimata Rd, near Lavina paan shop, Pologround, Freeganj, Raghuvanshi Colony, Indore, Madhya Pradesh 452015"
94,CDAC Authorized Training Centre (ORLANDO ACADEMY),095848 94999,"20-21 Press Complex, 1st Floor Above Mahanagar Press Behind Dainik Bhaskar, AB Rd, Indore, Madhya Pradesh 452001"
95,Online School of Programming,093022 55300,"Sundaram Complex, 2nd Floor, above Canera Bank, Bhanwar Kuwa, Indore, Madhya Pradesh 452014"
96,Online School Of Programming Private Limited,0731 326 2100,"LG-8, Lower Ground Floor, Kanchan Sagar, AB Rd, Near Industry House, New Palasia, Indore, Madhya Pradesh 452016"
97,IEPS Education Pvt.Ltd.,099938 36848,"ASHIRWAD BOYS HOSTEL, Swadesh Bhawan, IEPS EDUCATION PVT LTD 5, PRESS COMPLEX, BEHIND DAINK BHASKAR PRESS SCOLER YARD SCHOOL, AB Rd, Indore, Madhya Pradesh 452010"
98,Professional Adda | Corporate Training Institute | BE/B.Tech/MCA Jobs Internship In Indore,096447 04844,"5, Vishnu Puri, 103, Sukhmani Apartment, Bhawarkua Main Rd, above Union Bank, Indore, Madhya Pradesh 452014"
99,"C , C++ Programming Classes in Indore",NaN,"153 , Sundarum Complex, Madhya Pradesh 452014"
100,Arist Automation : PLC SCADA solutions,091112 25438,"204-205,3rd Floor,Mishika Tower, OPP, Sapna Sangeeta Rd, Indore, Madhya Pradesh 452014"
101,JAIN COMPUTER INSTIUTE,081201 45867,"402, Eastern Ring Rd, Sector A, Goyal Nagar, Indore, Madhya Pradesh 452018"
102,Ethical Hacking Training Institute in Indore - Armour Infosec,099777 47168,"410, Vibrant Tower, Manorama Ganj Geeta Bhawan Square, AB Rd, Indore, Madhya Pradesh 452001"
103,Design Solution,099072 01756,"213-214 Veda Business Park Bhawarkuan, Madhya Pradesh 452001"
104,J S Informatics,0731 426 3751,"117, Vijay Nagar, Indore, Madhya Pradesh 452001"
105,TEchnoPoint Computers,088397 31590,"528, Near Sethi Gate, Sector D, Sudama Nagar, Indore, Madhya Pradesh 452009"
106,SCS Placement Agency,NaN,"AB Rd, Scheme No 74, Vijay Nagar, Indore, Madhya Pradesh 452010"
107,bhavya technovision,099770 72278,"Apna Sweets, P4, 4th Floor, Shagun Building, AB Road, Scheme No.54, Vijay Nagar, Indore, Madhya Pradesh 452011"
108,Codeash,094794 40947,"231-A2, Trade Center, 18-SouthTukoganj, South Tukoganj, near Hotel Crown Palace, Indore, Madhya Pradesh 452001"
109,Techmotive Solutions,097538 05105,"201 bakahatgarh tower, 10/A, opposite Apna sweets, New Palasia, Indore, Madhya Pradesh 452001"
110,Vertex Education,0731 405 6686,"Main Rd, near Ranjeet Hanuman Mandir, Gumasta Nagar, Scheme 71, Indore, Madhya Pradesh 452009"
111,MAKHANLAL CHATURVEDI UNIVERSITY COURSES@INFOZONE --Best Institute for BCA/PGDCA/DCA/Steno in Indore,083190 80245,"2nd floor alankar point geeta bhawan square, AB Rd, Indore, Madhya Pradesh 452001"
112,Success Computer Center,091797 52526,"Front of Tealogy Cafe, Bholaram Ustad Marg, near by Mahakaleshwer Mandir, Bholaram Ustad Market, Brahmapuri Colony, Bhanwar Kuwa, Indore, Madhya Pradesh 452001"
113,Galbeaner Institute,097555 30444,"M-3, City Plaza, MG Road, Regal Square, Indore, Madhya Pradesh 452001"
114,Edo Square,099811 43434,"304 Bansi Plaza Opp. Indraprasth Towar, Mahatma Gandhi Rd, Indore, Madhya Pradesh 452010"
115,Defour Analytics Pvt ltd,074477 83841,"Office of 6DegreesIT Pvt Ltd 9/2 Manorama Ganj, Street No 5, Navratan Bagh, Indore, Madhya Pradesh 452001"
116,Geek Applications,094253 13915,"201, Shri Balaji Heights, AB Rd, Geeta Bhawan Square, Rajgarh Kothi, Manorama Ganj, Indore, Madhya Pradesh 452001"
117,Institute Of Computer Training,0731 424 8671,"163, Opposite Chl Appolo Hospitals Anoop Nagar, Anoop Nagar, Indore, Madhya Pradesh 452001"
118,"python ,DC , C,C++ by Jain Computer",NaN,"311, Footi Kothi Rd near Aditya Hospital Opposite Ranjeet Hanuman Usha Nagar, ext, Indore, Madhya Pradesh 452009, Indore, Madhya Pradesh 452007"
119,"Krishna Group of Institute, Indore",095758 51000,"7 A, AB Rd, Ratlam Kothi, Indore, Madhya Pradesh 452001"
120,"Infotech IT Academy, Indore",093021 06923,"Hanuman mandir, 4 DA SLICE 1 Aranya nagar, Scheme No 78 - III, OPP Bawari, Part II, Vijay Nagar, Indore, Madhya Pradesh 452010"
121,MCA internship in indore,090749 29734,"Satyam iT Solution 101(A) Sukhmani Apartment, Above Union Bank, vishnupuri iBus Stop, Bhawarkua,, Indore, Madhya Pradesh 452001"
122,"E-skills Web 2.0 Mern Stack, Wordpress, PHP, SEO, Digital Marketing Institute in Indore",091715 70073,"Ahinsa Tower, Mahatma Gandhi Rd, South Tukoganj, Indore, Madhya Pradesh 452001"
123,TechnoColabs,083192 91391,"Chandan Nagar, Indore, Madhya Pradesh 452002"
124,GYANDA INSTITUTE,091110 04690,"Dwarka Palace, G-10 , BUSINESS ISLAND BUILDING, NEAR, Nipania, Indore, Madhya Pradesh 452010"
125,"Autocad center vijay nagar indore,creo",NaN,"102 Near Sani Mandir Infront Of Astha Anoop Talkies, Vijay Nagar, Indore, Madhya Pradesh 452003"
126,"Institute for Data Analytics and Data Science in Indore, Artificial intelligence institute, Python classes in Indore",NaN,"Veda Business Park, near Apple Hospital, Bhanwar Kuwa, Indore, Madhya Pradesh 452001"
127,Best web design and development training Institute Indore India,087180 00520,"56, Khatiwala Tank Main Road, Transport Nagar, Indore, Madhya Pradesh, India, Indore, Madhya Pradesh 452001"
128,Advance computer institute,098267 54279,"Lg-7,empire house ushaganj,chawani, opp vaibhav chamber,, Indore, ph 9826754279, Madhya Pradesh 452001"
129,Java Project Training and 100% Placement,NaN,"105-106,NX, Shakuntala Complex, 1-2 Janki Nagar, Near Holkar Science College, Madhya Pradesh 452001"
130,JAVA / Digital Marketing Industrial Training Indore,NaN,"Bansiwala Tower, 410, Agrasen Square, Indore, Madhya Pradesh 452016"
131,TheYouthProject by TYP,NaN,"Currently Operating Remote, Apollo DB City, Nipania, Indore, Madhya Pradesh 452001"
132,Abhinav Saxena - Launch & Grow Food Business / Cloud kitchen,NaN,"The Address Township, Vrindavan Palace Colony, Pipliya Kumar, Indore, Madhya Pradesh 452018"
133,"AutoCAD training ,Indore",NaN,"Yeshwant Plaza, S-89, second floor, opposite railway station, near chhotti gwaltoli, Indore, Madhya Pradesh 452003"
134,Jagdish Classes,088391 71572,"Bulandshahr, Scheme Number 136, Indore, Madhya Pradesh 452010"
135,Konark Computer Education,098939 80908,"2128, Ring Rd, near dakshinmukhi hanuman mandir, Sector D, Sudama Nagar, Indore, Madhya Pradesh 452009"
136,"Indo German Tool Room, Indore",0731 421 0738,"452003, Sector E, Sanwer Road Industrial Area, Indore, Madhya Pradesh 452003"
137,dca pgdca center indore,096308 59189,"101 b sukhmani apartment ,vishnupuri main Rd,above union bank vishnupuri, AB Rd, Vishnu Puri Colony, Indore, Madhya Pradesh 452014"
138,OSTraining,NaN,"201 Relax Avenue, Opposite SICA School, Scheme No.54, Vijay Nagar, Indore, Madhya Pradesh 452010"
139,HP Internship - C/C++/Java/Php/Android/Python/Machine Learning/Matlab Training Institute,070818 11941,"Apollo DB City, Nipania, Indore, Madhya Pradesh 452001"
140,IICE,NaN,"PV5J+6WX, Veda Business park, near Apple Hospital, Indore, Madhya Pradesh 452001"
141,Sparc Tutorials,098260 15231,"Rajat Jayanti Complex, F-55, Vijay Nagar, Scheme 54 PU4, Indore, Madhya Pradesh 452001"
142,Computer training institute,098270 44222,"Sharma Complex, Talghar, South Rajmohalla, Jawahar Marg, Indore, Madhya Pradesh 452007"
143,DNS Software Solution,095842 76668,"106,, Cross Rd, Scheme Number 54, Vijay Nagar, Indore, Madhya Pradesh 452010"
144,NIIT,1800 3000 6448,"204, 206, 2nd Floor, Saphire Square, Sapna Sangeeta Rd, Tower Choraha Centre, Indore, Madhya Pradesh 452001"
145,Computer Institute,NaN,"5, ITI College Main Rd, Dubey Colony, Nanda Nagar, Indore, Madhya Pradesh 452011"
146,IBHNLP - The Best NLP Training in Indore / The Best NLP Course in Indore,098348 78870,"B-1, Maplewood Society, Mahalaxmi Nagar, Nipania Road Beside Bhavan's Prominent School, near Bombay Hospital, Indore, Madhya Pradesh 452007"
147,"Allen Career Institute, Palasia Campus, Indore",0731 472 8500,"25, Old Palasia Main Rd, Manorama Ganj, Indore, Madhya Pradesh 452001"
148,CADSTAR,095225 55221,"101, Sapphire Square, Tower Chouraha, Indore, Madhya Pradesh 452001"
149,iClass Surat,096722 34513,"Mahatma Gandhi Rd, Shastri Market, Nehru Park 2, New Palasia, Indore, Madhya Pradesh 452001"
150,Best Java Training Institutes and placements point Codesbloxx Software Solution,079998 22153,"216 D, D, Sector B, Vasundhara, Scheme No 51, Indore, Madhya Pradesh 452006"
151,"AWS , Java , Python , Linux, CCNA , C++ , Cloud , DevOps Training Institute in Indore",075060 09747,"203, Orange Business Park, Madhya Pradesh 452001"
152,Sangeeta Shree Education Society,NaN,"GF-37, Opposite Sayaji Hotel, Sceme No 54, Vijay Nagar, Indore, Madhya Pradesh 452010"
153,Amstech Group of Companies,099931 03282,"314, 3rd Floor, Veda Business Park, Bhawarkua Main Rd, Madhya Pradesh 452001"
154,Molle Software Solution's Private Limited,076970 54521,"29/1, HIG Main Rd, Nanda Nagar, Indore, Madhya Pradesh 452011"
155,Logical Coders (IT Training and Placement provider in Indore),078697 31595,"388, opposite of Eye Retina Hospital, Scheme 54 PU4, Indore, Madhya Pradesh 452010"
156,"ALLEN Career Institute, South Tukoganj Campus (H.O.), Indore",0731 472 8500,"Plot No.- 2, Nath Mandir Rd, opp. Bhoraskar Hospital, behind High Court, South Tukoganj, Indore, Madhya Pradesh 452001"
157,Web Zone Computer Education,089827 31250,"07, Patni Pura Rd, Patnipura Chowraha, Nanda Nagar, Indore, Madhya Pradesh 452001"
158,Indore coaching,NaN,"JRRJ+CJW, Sector B, Pulak City, Tulsi Parisar Phase 1, Indore, Madhya Pradesh 452012"
159,APTECH COMPUTER EDUCATION,0731 409 3334,"Chhawni Rd, Murai Mohalla, Chhawni, Indore, Madhya Pradesh 452001"
160,SGM Institute,0731 248 2263,"Flat No. 107, Lord Krishna Apartment, Annapurna Rd, In Front Of Talab Annapurna Road, Annapurna Nagar, Sudama Nagar, Indore, Madhya Pradesh 452009"
161,Thinking Machines,088153 40443,"A 22/5, Ujjain - Indore Rd, Vasant Vihar, Ujjain, Madhya Pradesh 456010"
162,"ZICA Institute - Top Rated Animation, VFX, Interior Design, Graphics, Web, Photography & Digital Marketing Institute",088786 88884,"101 - 102, DM Tower, Above Standard Chartered Bank, Near Janjeerwala Square, New Palasia, Indore, Madhya Pradesh 452001"
163,Veda Complex,NaN,"MVV8+8PV, Bhanwar Kuwa, Indore, Madhya Pradesh 452014"
164,Code In Mind,NaN,"4, 3, Maharani Rd, Siyaganj, Indore, Madhya Pradesh 452007"
165,Indore Institute of Computer Education,NaN,"133, 1st floor, Veda Business Park Bhawarkua Main Road Transport Nagar, Madhya Pradesh 452001"
166,Elite : Java Training in Indore,NaN,"305 Veda Complex Bhawarkua, Bhawarkua, Indore, Mhow, Madhya Pradesh 452001"
167,WebLogic Solution,NaN,"G-8-9, Appolo Trade Center, Gita Bhawan Rd, Indore, Madhya Pradesh 452001"
168,HPE Training Center,NaN,"Kanchan Sagar near industry House, Old Palasia, Indore, Madhya Pradesh 452014"
169,Rajmi Engineering Institute,NaN,"PVPF+3F3, Shivaji Nagar, Indore, Madhya Pradesh 452003"
170,GoPro Institute Of Information Technology GoproIIT,NaN,"108, 1st Floor, block B, Silver Mall, RNT Marg,, Indore MP, near railway station, Indore, Madhya Pradesh 452001"
171,CHILD COMPUTER CODING,NaN,"203, Block B Tulip Garden Apt, Pipliyahana Rd, Scheme No 140, Indore, Madhya Pradesh 452001"
172,Php Training Institutes,NaN,"156, Gita Bhawan Rd, Manorama Ganj, Kanchan Bagh, Indore, Madhya Pradesh 452001"
173,MentorXo,087708 11735,"PV8F+7CC, RNT Marg, Old Agarwal Nagar, Indore, Madhya Pradesh 452001"
