,Coaching Name,Coaching Phone_Number,Coching Address
174,Tech academy,NaN,"PV9C+MGC, Rabindranath Tagore Marg, Agarwal Nagar, Chhoti Gwaltoli, Indore, Madhya Pradesh 452001"
175,iot Training,NaN,"113,114 Nanrang Plaza sapna sangeeta Road, near bhawarkua, Tower Square, Indore, Madhya Pradesh 452010"
176,language C++ Cuboid Coaching Class,NaN,"PV9J+58C, Gita Bhawan Rd, Kanchan Bagh, Indore, Madhya Pradesh 452001"
177,Best SEO Course Training Institute Indore,NaN,"SH-29, First Floor, Saheed Sukhdev Complex, Vijay Nagar Square, near Shama Sweets, Indore, Madhya Pradesh 452010"
178,Education Temple coaching class,098268 48604,"MRJF+MV7, Surya Dev Nagar, Indore, Madhya Pradesh 452012"
179,EdSystango Kids,NaN,"Commerce House, 2nd floor, Janjeerwala Square, Indore, Madhya Pradesh 452001"
180,Orbit Computer Education,NaN,"214, Jawahar Marg, M.T Cloth Market, Raj Mohalla, Indore, Madhya Pradesh 452002"
181,FrontiaZ,NaN,"Airen Heights, 608, near Teleperformance, Indore, Madhya Pradesh 452020"
182,top 10 php coaching in indore,NaN,"Satyam it SOlution 101 sukhamni apprtment, above union bank vishnupuri bhawarkua indore, indore, Madhya Pradesh 452001"
183,.Net Training Indore,090099 99200,"26B, 2nd Floor, Sneh Nagar, near Rajpal Honda, Indore, Madhya Pradesh 452001"
184,SK Computers,NaN,"1st Floor ,GB TOWER, Bhanwar kuwan, Indore, Madhya Pradesh 452001"
185,Aptech Computer Education,0731 252 9988,"201, Gold Coin Plaza, Tower Chouraha, Near Hotel Shahnai, Indore, Madhya Pradesh 452001"
186,Best Blogging Training Courses for Beginners,NaN,"7, Anjani Nagar, Shikshak Nagar, Indore, Madhya Pradesh 452005"
187,Web Landmark,NaN,"301 Elite Urbane, Behind C21 Mall, Scheme 54 PU4, Indore, Madhya Pradesh 452011"
188,Best computer classes in indore,NaN,"2nd floor 595 Masakin-e-saifiya, Bijalpur, Madhya Pradesh 452020"
189,Technoshala computer and Programming language classes,NaN,"216 d sector, Scheme No 51, Indore, Madhya Pradesh"
190,Master Mind Computer Academy,0731 248 5544,"1 &2 Floor, Kandhari Plaza, Annapurna Road, Opposite Annapurna Temple, Annapurna Road, Indore, Madhya Pradesh 452009"
191,PARADISE COMPUTER CENTER,NaN,"9 Teja ji chouk, Palda, Indore, Madhya Pradesh 452020"
192,360DigiTMG Indore,NaN,"113, Green Star House, Annapurna Rd, Vishal Nagar, Indore, Madhya Pradesh 452012"
193,Indore computer academy,NaN,"QW35+G7G, Sector A, Mahalaxmi Nagar, Indore, Madhya Pradesh 452010"
194,Cambridge Institute Of Computing & Ielts Training,NaN,"4, Khajrana Main Rd, Khajrana, Indore, Madhya Pradesh 452016"
